<?xml version="1.0" encoding="UTF-8" ?>
<OutputParameters xmlns:xsi="http://www.w3.org/2001/XMLSchema-instance" xsi:schemaLocation="http://xmlns.oracle.com/pcbpel/adapter/db/sp/GetPersonData file:/C:/JDeveloper/mywork/MyAccountBPMApp_0913_02/RequestNameChange/xsd/GetPersonData_sp.xsd" xmlns="http://xmlns.oracle.com/pcbpel/adapter/db/sp/GetPersonData">
   <X_PERSON_DATA>
      <PARTY_ID>1</PARTY_ID>
      <PARTY_NUMBER>string2</PARTY_NUMBER>
      <STATUS>s</STATUS>
      <FIRST_NAME>string6</FIRST_NAME>
      <MIDDLE_NAME>string8</MIDDLE_NAME>
      <LAST_NAME>string10</LAST_NAME>
      <NAME_SUFFIX>string12</NAME_SUFFIX>
      <NICK_NAME>string14</NICK_NAME>
      <PERSON_TITLE>string16</PERSON_TITLE>
      <DATE_OF_BIRTH>2014-09-13T16:31:21.900</DATE_OF_BIRTH>
      <GENDER>string18</GENDER>
      <IS_MEMBER>s</IS_MEMBER>
      <MEMBER_TYPE>string22</MEMBER_TYPE>
      <MEMBER_STATUS>string24</MEMBER_STATUS>
      <PRIMARY_INSTITUTION>
         <PARTY_ID>26</PARTY_ID>
         <PARTY_NUMBER>string27</PARTY_NUMBER>
         <PARTY_NAME>string29</PARTY_NAME>
         <LONG_BUSINESS_NAME>string31</LONG_BUSINESS_NAME>
         <CLIA_NUMBER>string33</CLIA_NUMBER>
         <LAP_FLAG>s</LAP_FLAG>
         <HU_FLAG>s</HU_FLAG>
         <ADDRESS/>
         <ORG_CONTACTS/>
      </PRIMARY_INSTITUTION>
      <ATTRIBUTE1>string39</ATTRIBUTE1>
      <ATTRIBUTE2>string41</ATTRIBUTE2>
      <ATTRIBUTE3>string43</ATTRIBUTE3>
      <ATTRIBUTE4>string45</ATTRIBUTE4>
      <ATTRIBUTE5>string47</ATTRIBUTE5>
      <ATTRIBUTE6>string49</ATTRIBUTE6>
      <ATTRIBUTE7>string51</ATTRIBUTE7>
      <ATTRIBUTE8>string53</ATTRIBUTE8>
      <ATTRIBUTE9>string55</ATTRIBUTE9>
      <ATTRIBUTE10>string57</ATTRIBUTE10>
      <ATTRIBUTE11>string59</ATTRIBUTE11>
      <PREFERRED_ADDRESS>
         <ADDRESS/>
         <INSTITUTION_REC/>
      </PREFERRED_ADDRESS>
      <PREFERRED_EMAIL>
         <CONTACT_POINT_ID>61</CONTACT_POINT_ID>
         <EMAIL_ADDRESS>string62</EMAIL_ADDRESS>
         <EMAIL_FORMAT>string64</EMAIL_FORMAT>
      </PREFERRED_EMAIL>
      <PREFERRED_PHONE>
         <CONTACT_POINT_ID>66</CONTACT_POINT_ID>
         <PHONE_COUNTRY_CODE>string67</PHONE_COUNTRY_CODE>
         <PHONE_AREA_CODE>string69</PHONE_AREA_CODE>
         <PHONE_NUMBER>string71</PHONE_NUMBER>
         <PHONE_EXTENSION>string73</PHONE_EXTENSION>
         <RAW_PHONE_NUMBER>string75</RAW_PHONE_NUMBER>
         <PHONE_NUMBER_ALL>string77</PHONE_NUMBER_ALL>
         <PHONE_LINE_TYPE>string79</PHONE_LINE_TYPE>
      </PREFERRED_PHONE>
      <CREDENTIALS>
         <CREDENTIALS_ITEM/>
         <CREDENTIALS_ITEM/>
         <CREDENTIALS_ITEM/>
      </CREDENTIALS>
      <SPECIALITIES>
         <SPECIALITIES_ITEM/>
         <SPECIALITIES_ITEM/>
         <SPECIALITIES_ITEM/>
      </SPECIALITIES>
   </X_PERSON_DATA>
   <X_RETURN_STATUS>X_RETURN_STATUS81</X_RETURN_STATUS>
   <X_RETURN_MSG>X_RETURN_MSG82</X_RETURN_MSG>
</OutputParameters>
